{
  "title": "Engenheira de Software Sênior",
  "company": "Flash",
  "type": "CLT",
  "remote": "Remote",

  "source": {
    "platform": "Lever",
    "url": "https://jobs.lever.co/flashapp/4d649a5f-051e-4c1a-9f0a-d0207df059e0",
    "applicationUrl": "https://jobs.lever.co/flashapp/4d649a5f-051e-4c1a-9f0a-d0207df059e0/apply"
  },

  "description": "Senior software engineering role focused on technical excellence, scalable systems, architecture evolution, technical leadership, engineering quality, reliability and cross-team collaboration.",

  "responsibilities": [
    "Desenvolver soluções com excelência técnica e alta qualidade de código",
    "Contribuir para a arquitetura e integração de sistemas escaláveis",
    "Atuar como referência técnica por meio de revisões de código, mentorias e feedbacks",
    "Criar, acompanhar e evoluir métricas de qualidade, performance e SLAs",
    "Liderar discussões técnicas, promover inovação e definir padrões de tecnologia",
    "Colaborar com outras pessoas desenvolvedoras seniores na evolução das soluções",
    "Compartilhar conhecimento e boas práticas com o time",
    "Apoiar a definição e evolução de métricas de confiabilidade em parceria com SRE",
    "Pesquisar novas tecnologias, propor melhorias e desenvolver protótipos",
    "Estabelecer padrões técnicos de qualidade, consistência e segurança",
    "Trabalhar de forma colaborativa com diferentes squads e áreas",
    "Contribuir para a evolução da arquitetura aplicando Clean Architecture, Event-Driven Architecture e Domain-Driven Design"
  ],

  "qualifications": [
    "Experiência com Node.js, React e outros frameworks do ecossistema JavaScript",
    "Experiência no desenvolvimento e consumo de APIs REST, RPC ou GraphQL",
    "Experiência com bancos de dados como MongoDB e RDS",
    "Interesse em aprendizagem contínua e construção de soluções de alto impacto"
  ],

  "skills": [
    {
      "name": "Backend",
      "keywords": [
        "Node.js",
        "REST APIs",
        "RPC",
        "GraphQL"
      ]
    },
    {
      "name": "Frontend",
      "keywords": [
        "React",
        "JavaScript"
      ]
    },
    {
      "name": "Data",
      "keywords": [
        "MongoDB",
        "RDS"
      ]
    },
    {
      "name": "Architecture",
      "keywords": [
        "Clean Architecture",
        "Event-Driven Architecture",
        "Domain-Driven Design",
        "Scalable Systems"
      ]
    },
    {
      "name": "Engineering Practices",
      "keywords": [
        "Code Reviews",
        "Mentoring",
        "SLAs",
        "Performance Metrics",
        "Reliability",
        "Technical Leadership"
      ]
    }
  ],

  "requirements": {
    "required": [
      "Node.js",
      "React",
      "JavaScript",
      "REST APIs",
      "RPC",
      "GraphQL",
      "MongoDB",
      "RDS"
    ],

    "preferred": [
      "NestJS",
      "React Native",
      "Clean Architecture",
      "Domain-Driven Design",
      "Event-Driven Architecture",
      "Scalable Microservices",
      "AWS",
      "GCP",
      "Azure",
      "CI/CD",
      "Automated Testing"
    ],

    "competencies": [
      "Scalable Systems",
      "Code Reviews",
      "Mentoring",
      "SLAs",
      "Performance Metrics",
      "Reliability",
      "Technical Leadership"
    ]
  },

  "screening": [
    {
      "topic": "Node.js / NestJS",
      "type": "level"
    },
    {
      "topic": "Cloud platforms",
      "keywords": [
        "AWS",
        "GCP",
        "Azure"
      ],
      "type": "level"
    },
    {
      "topic": "Containers and orchestration",
      "keywords": [
        "Docker",
        "Kubernetes"
      ],
      "type": "boolean"
    },
    {
      "topic": "CI/CD",
      "type": "boolean"
    }
  ],

  "metadata": {
    "language": "pt-BR",
    "status": "active"
  }
}